{
  "$schema": "http://json-schema.org/draft-07/schema#",
  "$id": "https://schemas.hl7v2-rs.org/evidence/field-path-trace/v2",
  "title": "HL7v2 Field Path Trace v2",
  "description": "Machine-readable field-path trace written inside redacted evidence bundles, with explicit schema and tool provenance.",
  "type": "object",
  "additionalProperties": false,
  "required": [
    "schema_version",
    "tool_name",
    "tool_version",
    "message_type",
    "field_count",
    "fields"
  ],
  "properties": {
    "schema_version": {
      "const": "2"
    },
    "tool_name": {
      "type": "string",
      "enum": ["hl7v2-cli", "hl7v2-server", "hl7v2-python"]
    },
    "tool_version": {
      "type": "string"
    },
    "message_type": {
      "type": "string"
    },
    "field_count": {
      "type": "integer",
      "minimum": 0
    },
    "fields": {
      "type": "array",
      "items": {
        "$ref": "#/definitions/field_path_trace"
      }
    }
  },
  "definitions": {
    "field_path_trace": {
      "type": "object",
      "additionalProperties": false,
      "required": [
        "path",
        "canonical_path",
        "segment_index",
        "field_index",
        "present",
        "value_shape"
      ],
      "properties": {
        "path": {
          "description": "Segment-occurrence-qualified path, for example OBX[2].5. The segment_index field keeps the absolute one-based segment position.",
          "type": "string"
        },
        "canonical_path": {
          "type": "string"
        },
        "segment_index": {
          "type": "integer",
          "minimum": 1
        },
        "field_index": {
          "type": "integer",
          "minimum": 1
        },
        "present": {
          "type": "boolean"
        },
        "value_shape": {
          "type": "string",
          "enum": ["empty", "present", "hashed_sha256"]
        },
        "redaction_action": {
          "type": "string",
          "enum": ["hash", "drop", "retain"]
        }
      }
    }
  }
}
